{
  "dropped_details": [],
  "issues": [],
  "metrics": {
    "gate": {
      "error_drop_ratio": 0.0,
      "error_drops": 0
    },
    "info": {
      "ml_emission_ratio": 1.0
    },
    "qc2": {
      "all_drops_reported": true,
      "drop_reporting_ratio": 1.0
    },
    "sli1": {
      "covered_priority_sv_fields": 17,
      "priority_sv_fields_total": 17,
      "sli1_coverage_ratio": 1.0
    },
    "sli2": {
      "validation_pass_through_ratio": 1.0
    },
    "sli3": {
      "critical_invariant_violations_total": 0,
      "invariant_checked_total": 7,
      "invariant_compliance_ratio": 1.0,
      "invariant_correct_total": 7
    }
  },
  "outcome": {
    "status": "SUCCESS",
    "stop_reason": "all validations passed"
  },
  "report_schema_version": "1.3.0",
  "run": {
    "adapter_version": "0.1.0",
    "created_at_utc": "2000-01-01T00:00:00Z",
    "dataset_id": "D1_public_valid_small",
    "input_dir": "datasets/D1_public_valid_small",
    "mapping_version": "1.0.0",
    "profile_id": "default",
    "ruleset_version": "1.1.0",
    "run_id": "GOLDEN_D1_public_valid_small",
    "sv_schema_version": "1.0.0"
  },
  "run_flags": [],
  "summary": {
    "by_severity": {
      "CRITICAL": 0,
      "ERROR": 0,
      "INFO": 0,
      "WARN": 0
    },
    "by_stage": [
      {
        "errors": 0,
        "infos": 0,
        "stage": "READ_INPUT",
        "warnings": 0
      },
      {
        "errors": 0,
        "infos": 0,
        "stage": "STANDARDIZE_TO_SV",
        "warnings": 0
      },
      {
        "errors": 0,
        "infos": 0,
        "stage": "VALIDATE_SCHEMA",
        "warnings": 0
      },
      {
        "errors": 0,
        "infos": 0,
        "stage": "CHECK_INVARIANTS",
        "warnings": 0
      },
      {
        "errors": 0,
        "infos": 0,
        "stage": "PROJECT_ML",
        "warnings": 0
      },
      {
        "errors": 0,
        "infos": 0,
        "stage": "PROJECT_LLM",
        "warnings": 0
      },
      {
        "errors": 0,
        "infos": 0,
        "stage": "FORMAT_FOR_MODEL",
        "warnings": 0
      },
      {
        "errors": 0,
        "infos": 0,
        "stage": "WRITE_OUTPUTS",
        "warnings": 0
      }
    ],
    "counts": {
      "accounts_total": 1,
      "llm_contexts": 1,
      "ml_rows": 7,
      "transactions_dropped": 0,
      "transactions_emitted_sv": 7,
      "transactions_total": 7
    }
  }
}
