{
  "dropped_details": [],
  "issues": [
    {
      "code": "QC-1_COUNTERPARTY_MISSING",
      "message": "counterparty name and IBAN both absent.",
      "refs": {
        "account_id": "c3a1b2d0-5f3e-4901-bcde-234567890100",
        "field_path": null,
        "record_id": "a11627f11a86bdf8",
        "source_lineage": "transactions_1.json"
      },
      "severity": "INFO",
      "stage": "CHECK_INVARIANTS"
    },
    {
      "code": "QC-1_COUNTERPARTY_MISSING",
      "message": "counterparty name and IBAN both absent.",
      "refs": {
        "account_id": "c3a1b2d0-5f3e-4901-bcde-234567890100",
        "field_path": null,
        "record_id": "94d3286583fb0dfb",
        "source_lineage": "transactions_1.json"
      },
      "severity": "INFO",
      "stage": "CHECK_INVARIANTS"
    },
    {
      "code": "QC-1_COUNTERPARTY_MISSING",
      "message": "counterparty name and IBAN both absent.",
      "refs": {
        "account_id": "c3a1b2d0-5f3e-4901-bcde-234567890100",
        "field_path": null,
        "record_id": "4524a1830bf6682d",
        "source_lineage": "transactions_1.json"
      },
      "severity": "INFO",
      "stage": "CHECK_INVARIANTS"
    },
    {
      "code": "QC-1_COUNTERPARTY_MISSING",
      "message": "counterparty name and IBAN both absent.",
      "refs": {
        "account_id": "d4b2c3e1-6041-4a12-cdef-345678901200",
        "field_path": null,
        "record_id": "bf32e1f516548200",
        "source_lineage": "transactions_2.json"
      },
      "severity": "INFO",
      "stage": "CHECK_INVARIANTS"
    },
    {
      "code": "QC-1_COUNTERPARTY_MISSING",
      "message": "counterparty name and IBAN both absent.",
      "refs": {
        "account_id": "d4b2c3e1-6041-4a12-cdef-345678901200",
        "field_path": null,
        "record_id": "a8dc6957ffb57543",
        "source_lineage": "transactions_2.json"
      },
      "severity": "INFO",
      "stage": "CHECK_INVARIANTS"
    }
  ],
  "metrics": {
    "gate": {
      "error_drop_ratio": 0.0,
      "error_drops": 0
    },
    "info": {
      "ml_emission_ratio": 1.0
    },
    "qc2": {
      "all_drops_reported": true,
      "drop_reporting_ratio": 1.0
    },
    "sli1": {
      "covered_priority_sv_fields": 17,
      "priority_sv_fields_total": 17,
      "sli1_coverage_ratio": 1.0
    },
    "sli2": {
      "validation_pass_through_ratio": 1.0
    },
    "sli3": {
      "critical_invariant_violations_total": 0,
      "invariant_checked_total": 148,
      "invariant_compliance_ratio": 1.0,
      "invariant_correct_total": 148
    }
  },
  "outcome": {
    "status": "SUCCESS",
    "stop_reason": "all validations passed"
  },
  "report_schema_version": "1.3.0",
  "run": {
    "adapter_version": "0.1.0",
    "created_at_utc": "2000-01-01T00:00:00Z",
    "dataset_id": "D11_real_anon_2024",
    "input_dir": "datasets/D11_real_anon_2024",
    "mapping_version": "1.0.0",
    "profile_id": "default",
    "ruleset_version": "1.1.0",
    "run_id": "GOLDEN_D11_real_anon_2024",
    "sv_schema_version": "1.0.0"
  },
  "run_flags": [],
  "summary": {
    "by_severity": {
      "CRITICAL": 0,
      "ERROR": 0,
      "INFO": 5,
      "WARN": 0
    },
    "by_stage": [
      {
        "errors": 0,
        "infos": 0,
        "stage": "READ_INPUT",
        "warnings": 0
      },
      {
        "errors": 0,
        "infos": 0,
        "stage": "STANDARDIZE_TO_SV",
        "warnings": 0
      },
      {
        "errors": 0,
        "infos": 0,
        "stage": "VALIDATE_SCHEMA",
        "warnings": 0
      },
      {
        "errors": 0,
        "infos": 0,
        "stage": "CHECK_INVARIANTS",
        "warnings": 0
      },
      {
        "errors": 0,
        "infos": 0,
        "stage": "PROJECT_ML",
        "warnings": 0
      },
      {
        "errors": 0,
        "infos": 0,
        "stage": "PROJECT_LLM",
        "warnings": 0
      },
      {
        "errors": 0,
        "infos": 0,
        "stage": "FORMAT_FOR_MODEL",
        "warnings": 0
      },
      {
        "errors": 0,
        "infos": 0,
        "stage": "WRITE_OUTPUTS",
        "warnings": 0
      }
    ],
    "counts": {
      "accounts_total": 2,
      "llm_contexts": 2,
      "ml_rows": 148,
      "transactions_dropped": 0,
      "transactions_emitted_sv": 148,
      "transactions_total": 148
    }
  }
}
